{
  "set_code": "IAR",
  "pack_size": 16,
  "slots": [
    { "id": "common", "count": 11, "rarities": { "C": 1.0 }, "draftable": true },
    { "id": "rare", "count": 1, "rarities": { "R": 1.0 }, "draftable": true },
    {
      "id": "rare_or_majestic",
      "count": 1,
      "rarities": { "R": 0.5, "M": 0.5 },
      "majestic_subset": "core",
      "draftable": true,
      "confidence": "ESTIMATED"
    },
    {
      "id": "rainbow_foil",
      "count": 1,
      "rarities": { "C": 0.75, "R": 0.2, "M": 0.05 },
      "foiling": "RF",
      "draftable": true,
      "confidence": "ESTIMATED"
    },
    { "id": "basic", "count": 1, "rarities": { "B": 1.0 }, "draftable": false },
    {
      "id": "chase",
      "count": 1,
      "rarities": {
        "B": 0.62,
        "M_expansion": 0.2,
        "L": 0.08,
        "V": 0.07,
        "F": 0.01,
        "CF": 0.02
      },
      "draftable": false,
      "confidence": "ESTIMATED"
    }
  ],
  "no_duplicate_uids_within_pack": true,
  "cold_foil_rate_per_pack": 0.0417
}
